{
  "id": "cad-module-2",
  "course": "cad",
  "title": "Module 2: Application Analysis and Design",
  "description": "Planning and design before building: defining stakeholders and roles, inputs/outputs, the data model, client-side vs server-side architecture, UI options, and ServiceNow design recommendations.",
  "questions": [
    {
      "id": "q1",
      "type": "single",
      "difficulty": "medium",
      "prompt": "In ServiceNow, user personas defined during design largely map to which platform concept used to apply security?",
      "choices": [
        { "key": "A", "text": "Update Sets" },
        { "key": "B", "text": "Roles" },
        { "key": "C", "text": "Client Scripts" },
        { "key": "D", "text": "Business Rules" }
      ],
      "correct": ["B"],
      "explanation": "Personas largely equate to roles in ServiceNow, and security is generally applied to applications and their records using roles."
    },
    {
      "id": "q2",
      "type": "single",
      "difficulty": "medium",
      "prompt": "What is the recommendation regarding the minimum roles an application should define?",
      "choices": [
        { "key": "A", "text": "A single Admin role is sufficient for any application." },
        { "key": "B", "text": "At least a User role and an Admin role." },
        { "key": "C", "text": "One role per table in the application." },
        { "key": "D", "text": "No application-specific roles; reuse the global admin role only." }
      ],
      "correct": ["B"],
      "explanation": "It is recommended that every application have at least a User role and an Admin role."
    },
    {
      "id": "q3",
      "type": "single",
      "difficulty": "hard",
      "prompt": "When planning inputs, what does the \"coalesce\" consideration address?",
      "choices": [
        { "key": "A", "text": "How frequently the data is received." },
        { "key": "B", "text": "What makes a record unique, so duplicates are matched and updated, not re-inserted." },
        { "key": "C", "text": "Which specific user role is permitted to submit this particular input data record." },
        { "key": "D", "text": "The visual layout of the input form." }
      ],
      "correct": ["B"],
      "explanation": "Coalesce concerns what makes data unique, which is how the platform decides whether incoming data matches an existing record (to avoid duplicates) versus creating a new one."
    },
    {
      "id": "q4",
      "type": "single",
      "difficulty": "medium",
      "prompt": "Which input method is suggested for loading data that arrives as a spreadsheet file?",
      "choices": [
        { "key": "A", "text": "A custom Service Portal widget" },
        { "key": "B", "text": "An Import Set" },
        { "key": "C", "text": "A Business Rule" },
        { "key": "D", "text": "A Scheduled Report" }
      ],
      "correct": ["B"],
      "explanation": "Spreadsheet input is retrieved via an Import Set."
    },
    {
      "id": "q5",
      "type": "multi",
      "difficulty": "medium",
      "prompt": "Which of the following are examples of foundation data that is shared by many different applications? (Choose 3)",
      "choices": [
        { "key": "A", "text": "user" },
        { "key": "B", "text": "cmdb_ci" },
        { "key": "C", "text": "task" },
        { "key": "D", "text": "A custom application-specific table" }
      ],
      "correct": ["A", "B", "C"],
      "explanation": "user, cmdb_ci, and task are foundation data shared by many applications. Application-specific tables are unique to a given app."
    },
    {
      "id": "q6",
      "type": "single",
      "difficulty": "hard",
      "prompt": "To represent people in a new application without breaking existing relationships, what approach is recommended?",
      "choices": [
        { "key": "A", "text": "Extend the user table directly so that the new application automatically inherits all of its user fields." },
        { "key": "B", "text": "Create a custom table that references the existing user table, preserving its many-to-many links." },
        { "key": "C", "text": "Duplicate all user records into a new standalone table." },
        { "key": "D", "text": "Store people as comma-separated values in a single string field." }
      ],
      "correct": ["B"],
      "explanation": "Rather than extending the user table, build a custom table that references the existing user table, so the established many-to-many relationships (users-groups, users-roles, and so on) remain intact."
    },
    {
      "id": "q7",
      "type": "single",
      "difficulty": "medium",
      "prompt": "What is the guidance on client-side scripting in a scoped application's architecture?",
      "choices": [
        { "key": "A", "text": "Maximize client-side scripting to reduce server load." },
        { "key": "B", "text": "Keep client-side scripting to a minimum (thin client)." },
        { "key": "C", "text": "Client-side scripting is not allowed in scoped applications." },
        { "key": "D", "text": "All logic must run client-side for performance." }
      ],
      "correct": ["B"],
      "explanation": "Client-side scripting should be kept thin, with reusable logic placed server-side."
    },
    {
      "id": "q8",
      "type": "single",
      "difficulty": "medium",
      "prompt": "Which artifact provides a single location for reusable server-side functions, reducing maintenance effort?",
      "choices": [
        { "key": "A", "text": "Client Script" },
        { "key": "B", "text": "UI Policy" },
        { "key": "C", "text": "Script Include" },
        { "key": "D", "text": "Notification" }
      ],
      "correct": ["C"],
      "explanation": "Script Includes provide a single location for reusable functions, reducing maintenance and time-to-completion."
    },
    {
      "id": "q9",
      "type": "multi",
      "difficulty": "medium",
      "prompt": "When designing the user experience, which of the following are valid ways users might interact with an application? (Choose 3)",
      "choices": [
        { "key": "A", "text": "Standard catalog item or record producer" },
        { "key": "B", "text": "Workspace" },
        { "key": "C", "text": "Portal or mobile experience" },
        { "key": "D", "text": "Update Set" }
      ],
      "correct": ["A", "B", "C"],
      "explanation": "Interaction options include a standard catalog item, record producer, workspace, portal, and mobile experience. An Update Set is a deployment/configuration-transfer mechanism, not a user interaction method."
    },
    {
      "id": "q10",
      "type": "multi",
      "difficulty": "hard",
      "prompt": "Which of the following are recommended ServiceNow application design practices? (Choose 3)",
      "choices": [
        { "key": "A", "text": "Develop private-scoped applications." },
        { "key": "B", "text": "Give every process its own scope." },
        { "key": "C", "text": "Track development tasks." },
        { "key": "D", "text": "Put all logic in the global scope for easier sharing." }
      ],
      "correct": ["A", "B", "C"],
      "explanation": "Recommended practices are to develop private-scoped applications, give every process its own scope, follow delegated development practices, and track development tasks. Defaulting everything to global scope contradicts this guidance."
    },
    {
      "id": "q11",
      "type": "single",
      "difficulty": "hard",
      "prompt": "An application administrator will need a way to adjust application settings after go-live without code changes. What should the developer do about this?",
      "choices": [
        { "key": "A", "text": "Nothing at all; configurable settings can always be added instantly at the very end of development." },
        { "key": "B", "text": "Plan for it during design, e.g. include a properties module so settings stay configurable." },
        { "key": "C", "text": "Hard-code all of the settings and require a brand-new deployment in order to change any of them." },
        { "key": "D", "text": "Store settings only in client-side scripts." }
      ],
      "correct": ["B"],
      "explanation": "Conveniences like a properties module for configurable settings must be planned for during design; they cannot simply be snapped into place at the end of the development cycle."
    }
  ]
}
